title,url,date,content,author,views,recommend,dislike,comments
달에 유흥100이면 괜찮음?,https://gall.dcinside.com/board/view/?id=bitcoins_new1&no=7937147,2025-02-11 12:11:05,"29모쏠 여자랑 대화,손잡은적없음 앞으로 여자랑못만날텐데한달에 유흥100이면 ㄱㅊ?29에남자 97년생 모은돈5800만원 차는아반떼타고다님달에 적으면350 많으면420범유흥은 주에1번 한주는오피 한주는스웨 이런식으로감",비갤러 (125.186),155,0,1,0
달에 유흥100이면 괜찮음?,https://gall.dcinside.com/board/view/?id=maplestory_new&no=9397830,2025-02-11 12:10:57,"29모쏠 여자랑 대화,손잡은적없음 앞으로 여자랑못만날텐데한달에 유흥100이면 ㄱㅊ?29에남자 97년생 모은돈5800만원 차는아반떼타고다님달에 적으면350 많으면420범유흥은 주에1번 한주는오피 한주는스웨 이런식으로감",메갤러 (125.186),58,0,0,0
달에 유흥100이면 괜찮음?,https://gall.dcinside.com/board/view/?id=football_new9&no=2976195,2025-02-11 12:10:48,"29모쏠 여자랑 대화,손잡은적없음 앞으로 여자랑못만날텐데한달에 유흥100이면 ㄱㅊ?29에남자 97년생 모은돈5800만원 차는아반떼타고다님달에 적으면350 많으면420범유흥은 주에1번 한주는오피 한주는스웨 이런식으로감",해갤러 (125.186),39,0,0,0
달에 유흥100이면 괜찮음?,https://gall.dcinside.com/board/view/?id=loan_new1&no=11983837,2025-02-11 12:10:38,"29모쏠 여자랑 대화,손잡은적없음 앞으로 여자랑못만날텐데한달에 유흥100이면 ㄱㅊ?29에남자 97년생 모은돈5800만원 차는아반떼타고다님달에 적으면350 많으면420범유흥은 주에1번 한주는오피 한주는스웨 이런식으로감",대갤러 (125.186),17,0,0,0
달에 유흥100이면 괜찮음?,https://gall.dcinside.com/board/view/?id=leagueoflegends6&no=6026622,2025-02-11 12:10:24,"29모쏠 여자랑 대화,손잡은적없음 앞으로 여자랑못만날텐데한달에 유흥100이면 ㄱㅊ?29에남자 97년생 모은돈5800만원 차는아반떼타고다님달에 적으면350 많으면420범유흥은 주에1번 한주는오피 한주는스웨 이런식으로감",롤갤러 (125.186),38,0,0,0
달에 유흥100이면 괜찮음?,https://gall.dcinside.com/board/view/?id=sa&no=696991,2025-02-11 12:10:14,"29모쏠 여자랑 대화,손잡은적없음 앞으로 여자랑못만날텐데한달에 유흥100이면 ㄱㅊ?29에남자 97년생 모은돈5800만원 차는아반떼타고다님달에 적으면350 많으면420범유흥은 주에1번 한주는오피 한주는스웨 이런식으로감",서갤러 (125.186),139,1,1,0
아반떼1700이면 어느정돈가요?,https://gall.dcinside.com/mgallery/board/view/?id=used_car&no=30225,2025-02-11 12:02:27,1.6 가솔린이구요4만키로에 주인 한번도 안바뀐 1인신조21년식중간트림 모던트림에 현대스마트센스 + 인포태인먼트 네비추가되었습니다.외부패널 및 프레임 교환 판금 0건이고 무사고 입니다.근데 왜 무사고라고 나와있는지는 모르겠는데 (케이카)내차 피해 60만원이 있습니다.내역을 자세히보니라디에이터그릴(교환)/라디그릴상부커버(탈착)/스티프너(탈착) / 프런트범퍼(도장) / 프런트범퍼커버(교환)그리고 3만정도 타다가 파워스티어링기어 관련부품 교체이력있습니다. 어떤가요?,ㅇㅇ (122.42),96,0,0,0
아반떼n라인 승차감 어떰?,https://gall.dcinside.com/board/view/?id=car_new1&no=10379229,2025-02-11 12:00:46,N라인은 멀티링크드가던데 엣날 hd랑 비슷함?- dc official App,차갤러 (39.121),30,0,0,0
아반떼쥐색이 이런 느낌이냐?,https://gall.dcinside.com/mgallery/board/view/?id=galaxy&no=1781645,2025-02-11 11:48:34,블블 색이 이렇다고?,갤붕이 (121.157),212,0,0,0
블블단 고해성사 한다.,https://gall.dcinside.com/mgallery/board/view/?id=galaxy&no=1781637,2025-02-11 11:45:58,블루 블랙이 아니라 그냥 쥐색이다처음에는 조금 이뻐 보엿는데보면 볼수록 쥐색 아반데 보는것 같다이제 살사람 다 삿고 환불 못하니 고해성사 한다...,갤붕이 (125.140),175,0,0,0
아반떼cn7 10만이상 탈수있냐??,https://gall.dcinside.com/board/view/?id=car_new1&no=10379098,2025-02-11 11:10:40,ㅇㄴㅇ- dc official App,차갤러 (211.234),66,0,0,0
아반떼N은 무조건 수동만 타야하는차임?,https://gall.dcinside.com/board/view/?id=car_new1&no=10379093,2025-02-11 11:08:39,오토미션있는건 아는데차 성능때문에라도 수동 타야하는 차임?,黄前久美子 (221.143),71,0,0,0
카푸어 없는 차 찾는게 더 힘들겠다,https://gall.dcinside.com/board/view/?id=car_new1&no=10379088,2025-02-11 11:05:51,아반떼도 빚내서 사는데 뭘...,휠작은찐따 (175.203),77,0,0,0
아반떼N 풍차돌릴려면 뭐타야됩니까,https://gall.dcinside.com/board/view/?id=car_new1&no=10379064,2025-02-11 10:55:57,아엔한테 조롱당하고 울화가 치미는데요저는 지금 프레지오 봉고차 타고있습니다아엔 따고싶습니다뭘타면 아엔 빽점가능합니가 알려주십쇼,ㅇㅇ (175.203),77,0,0,0
걍 교사 커트라인을 최소 서울대에 연봉 의사급으로 주는 게 맞음,https://gall.dcinside.com/board/view/?id=baseball_ab2&no=9725953,2025-02-11 10:51:53,어차피 인구절벽이라 예전처럼 교사들 뗴거지로 뽑을 필요도 없고 철밥통 지켜줄 필요도 없는데걍 엘리트직군으로 만들어버려야지하나 컨트롤 못해서 꼴랑 사범대 나오고 아반떼 모는 새끼들이 뭔 애들을 관리하고 육성한다고,ㅇㅇ (220.117),77,0,0,0
쏘나타도 카푸어임,https://gall.dcinside.com/board/view/?id=car_new1&no=10378865,2025-02-11 10:08:09,솔직히 대한민국에선 아반떼 이상은 그냥 돈지랄임,ㅇㅇ (118.235),30,0,0,0
아반떼k3도 카푸어인음?,https://gall.dcinside.com/board/view/?id=car_new1&no=10378832,2025-02-11 10:00:20,ㅈㄱㄴ,차갤러 (1.238),27,0,0,0
지카 대차만 2번 받네,https://gall.dcinside.com/mgallery/board/view/?id=carsharing&no=36241,2025-02-11 09:33:18,전기차 예약했다가 사고수리로 아반떼로 대차하고 오늘 타는 날인데 아침에 아반떼도 문제 있다고 문자와서 결국엔 캐스퍼로 타게 됨...,카갤러 (122.42),116,0,0,0
아반떼이빵텁 사고싶다 어캄?,https://gall.dcinside.com/board/view/?id=car_new1&no=10378742,2025-02-11 09:19:02,저에게ㅜ용기를 주소서- dc official App,일하기어렵다 (175.203),48,0,0,0
스팅어에 로드 넣기 가능임?,https://gall.dcinside.com/mgallery/board/view/?id=cycle&no=868799,2025-02-11 08:26:52,다라이 540인가 560공이엇는데뒷자리 들어갈라나...?첫차로 아반떼 생각하고잇엇는데 개꼴리네 갑자기,Foil_109 (223.39),171,0,1,0
언덕애서 내려오는아반떼보는데,https://gall.dcinside.com/board/view/?id=car_new1&no=10378621,2025-02-11 08:06:17,개빻았네 아반떼 특정각도에서 개빻음 납짝해서 무슨 벌레같은 느낌임,ㅇㅇ (118.235),67,1,1,0
그래도 현실은 320i >아반떼N 맞음?,https://gall.dcinside.com/board/view/?id=car_new1&no=10378602,2025-02-11 07:49:36,ㅈㄱㄴ,차갤러 (58.180),88,0,0,0
고랩들 직업밸런스는 지금 비교하는것이 의미가 없는게,https://gall.dcinside.com/mini/board/view/?id=kow_clean&no=16038,2025-02-11 07:26:41,"만랩이 수백명 쌓였는데810제 보스 인드라840대 사냥터 데칸치면서 영혼력 보너스, 레벨차 보너스 받아가면서 나오는 딜로 직업간 밸런스 비교하는건 진짜 의미가 없음. 이건 속도제한 백키로에서 아반떼가 부가티랑 같이 백키로 나오니 성능 동급이다 이런 수준임. 신사냥터나오고 맥뎀 영향 안받아야 제대로 된 비교가 가능할듯. 직업들 딜계수의 민낯이 드러날거임. 그리고 신사냥터도 방어 허벌이라 방관방무보단 뎀뻥스킬이 매우 중요함. 도사랑 같이가면 체감 엄청날듯.",불난사 (218.37),723,6,0,0
아반떼스마트 트림 그렇게 별로임?,https://gall.dcinside.com/board/view/?id=car_new1&no=10378487,2025-02-11 04:54:06,스마트 트림 옵션 다 넣어서 차값 2200 언저리로 뽑고 싶은데핸따 엉따 통풍 없는게 그렇게 별로임???첫 차임,차갤러 (125.184),117,0,0,0
아반떼자흡을 2600이나 주고 사다니,https://gall.dcinside.com/board/view/?id=car_new1&no=10378476,2025-02-11 04:37:23,"난 기존 디젤차 폐차할인받고아반떼 1.6터보를 1900에 삿느데 ,자흡을 2600이나 태우다니너무비싸다",운동 맛있게 투운 (1.213),158,0,0,0
김웅서는아반떼가 쪽팔려가 죽었는데,https://gall.dcinside.com/mgallery/board/view/?id=bodybuilding&no=2782091,2025-02-11 03:33:21,나는 아반떼n이라도 사고싶다씨발 차 나주고 가지,ㅇㅇ (106.102),463,0,0,0
야순이아반떼ㅜ샀음,https://gall.dcinside.com/board/view/?id=baseball_new11&no=16998249,2025-02-11 01:56:34,,ㅇㅇ (1.246),440,11,0,0
지금아반떼cn7 사면 좀 아니야?,https://gall.dcinside.com/board/view/?id=car_new1&no=10378296,2025-02-11 01:11:24,"소득은 세후로 4300후반? 아무튼 그래. 모아둔 돈은  1000정도고이번 여름에 차 사려고 하는데 지금 아반떼 모델 사지 말고 기다렸다가 내년에 사는게 나아?소득 수준이나 지금 재산수준 꼬라지에선 아반떼가 최선 같네.근데 아반떼가 연말에 신형 모델 나온다길래.. 이거 기다렸다가 사는게 맞을지 6월에 출고 하는게 맞는지 고민되네 ㅠㅠ부모님이 2000정도 지원 해주신다고 했는데, 신차살때만이고 중고차 살거면 니맘대로 니 돈으로 사래서 신차로 사야함.",차갤러 (223.39),164,1,1,0
30살 남자 셀토스 샀는데 좆된거니?,https://gall.dcinside.com/board/view/?id=car_new1&no=10378269,2025-02-11 00:55:15,경차 몇달 몰아보고 첫차 산거라 운전미숙해서 작은차로 알아봤음.장거리 한번씩 다닐 일이 있어서 경차는 주변에서 반대해서 아반떼보다 소형suv가 짧길래 알아보다 엔진미션 맘에 들어서 셀토스 샀는데...갤에 셀토스만 검색해서 봐도 평이 진짜 안좋네...  이제 2주정도 탔는데 경차타다 타서 그런가 옵션도 시그니처에 국민 3옵넣어서 신세계같고 좋은디 난...시트도 캐러멜해서 여친도 너무 좋아하는데 뭔가 평보니까 난 한순간에 인생 망한 하류루저꼬작남된 기분이노....진짜 셀토스가 그리 안좋은 차냐...?,차갤러 (106.101),197,0,2,0
와아반떼n 물건이네,https://gall.dcinside.com/mgallery/board/view/?id=drivesafe&no=1825,2025-02-11 00:51:07,스완넥 옵션에 수동있고중통 직관까지 튜닝하면 진짜 간지날듯 이거사고싶어,크림빵 (175.199),23,0,0,0
아반떼살까요k3살까요,https://gall.dcinside.com/board/view/?id=diet&no=6940115,2025-02-11 00:37:34,,뷰르르릇 (112.221),48,0,0,0
님들아반떼삼k3삼,https://gall.dcinside.com/mgallery/board/view/?id=workoutdietproof&no=45677,2025-02-11 00:37:13,제발,뷰르르릇 (223.39),30,0,0,0
메기타 vs아반떼cn7,https://gall.dcinside.com/mgallery/board/view/?id=used_car&no=30211,2025-02-10 23:56:59,"대한민국 No.1 직영중고차https://m.kcar.com/bc/detail/CarInfoDtl?i_sCarCd=EC61128117&shareFlag=YK Car - 대한민국 No.1 직영중고차국내 최대 규모 직영 중고차 매매 플랫폼 K Car, 하루만에 중고차 사고 팔고, 온라인 구매 집앞배송, 3일 책임환불, 최대2년보증m.kcar.com1950만대한민국 No.1 직영중고차https://m.kcar.com/bc/detail/CarInfoDtl?i_sCarCd=EC61137726&shareFlag=YK Car - 대한민국 No.1 직영중고차국내 최대 규모 직영 중고차 매매 플랫폼 K Car, 하루만에 중고차 사고 팔고, 온라인 구매 집앞배송, 3일 책임환불, 최대2년보증m.kcar.com1750만초보운전 첫차인데 뭐가 더 낫냐?",펩시제로 (61.77),104,0,0,0
아반떼17년 4만 vs 18년 7만 뭐살까 ?,https://gall.dcinside.com/mgallery/board/view/?id=used_car&no=30210,2025-02-10 23:35:03,둘다 무사고 가격도 비슷하다면17년식 4만키로 vs 18년식 7만키로 뭐살까 ?,중갤러 (117.110),31,0,0,0
아반떼cn7 LPG 단순수리 vs 가솔린 무사고,https://gall.dcinside.com/mgallery/board/view/?id=used_car&no=30209,2025-02-10 23:22:56,신차로 가고싶지만 어렵고요.. 연비를 중요하게 생각해서 LPG로 가고싶은데(가스 충전 불편해도 상관없음) 수리를 4번이나 해서 좀 신경쓰이네요 ㅠㅠLPG 21년 5월식 48000km 1790만원가솔린 20년 4월식 19000km 2050만원아래 사진은 LPG 정비소 이력인데 함 봐주시면 감사하겠슴다 !,중갤러 (118.235),67,0,0,0
이거 사면 로아 fhd는 문제없이 돌리냐?,https://gall.dcinside.com/board/view/?id=pridepc_new4&no=5361467,2025-02-10 23:09:54,고민 존나했는데 고민하면 할수록 아반테 사러와서 그랜져 보고있는 느낌임걍 이거 125에 사고 끝낼까싶다,ㅇㅇ (14.7),76,0,0,0
내가 시승한 차가 퀵실버가 맞는지 모르겟어,https://gall.dcinside.com/mgallery/board/view/?id=tesla&no=48520,2025-02-10 23:08:24,위가 내가 찍은거거든왜케 사진이랑 다르지지금 내가 끌고다니는 아반떼 플루이드 메탈릭 그레이보다 더 펄이 안들어간 느낌이야인터넷에 올라온 사진하고도 느낌 많이 다르고하랜에도 건 메탈릭 색깔이 있었다가 사라진건 아니지? 그냥 광원차이인거같긴한데 혹시나,글로리아 (39.112),321,0,0,0
ts) 아카빵의 캐붕은 시우만이 아닌데,https://gall.dcinside.com/mgallery/board/view/?id=genrenovel&no=9960336,2025-02-10 23:01:23,외전에서만으로 한정한다고 하면 시우만이지한사람만을 기다리는 시우모습까지보이고 깨어나니까 그토록 기뻐하며반기고 고백결심하지만결과는 아반데가 거절을 그렇게나 하면서 정색까지하는데거기서 또 포기하지 않고 고백을 100번이나 하면 결국 성공하고그렇게 관계 깊어지기도 하는데갑자기 걸레놈이 돼서 에반젤린한테도 대준다는거잖아?이것만으로도 말이 안되지만본편까지하면 에반데는 이미 시우가 눈을 뜨지못했을때 보여줬던 애틋함 그리고 키스까지하려고 했었고 서로 희생하며 서로가 너무 애틋한 그런 분위기였는데갑자기 외전에서는 에반데가 자기마음을 자각 못한채 그렇게 차갑게 굴면서 거절한다고? 그것부터가 이상했어,ㅇㅇ (223.39),116,0,0,0
차잘알 형님들 선택좀요!,https://gall.dcinside.com/board/view/?id=car_new1&no=10377969,2025-02-10 22:51:03,1. 3년 연식에 2만 뛴 아반떼 cn7 풀옵 중고현대인증 + 1인신조무사고a급차량세금 합쳐서 24002. 아반떼 2025 신차 스마트 스트림+휠 +네비 +스마트키세금 합쳐서 2500대학원생이고 엄마가 사주시는 거고 6-7년은 타라고 하심뭐가 나음?,차갤러 (119.149),45,0,0,0
본인아반떼cn7이 처음이자 마지막 신차인듯ㅠ,https://gall.dcinside.com/board/view/?id=car_new1&no=10377927,2025-02-10 22:38:58,본인 능력으론 소득이 연봉 5천을 못넘기고 관짝갈듯cn7 10년 타다 폐차하면 중고나 사야 되는 인생일듯 ㅠ- dc official App,차갤러 (223.38),82,0,0,0
아반떼cn7 아그vs에그 실제로 보신 분,https://gall.dcinside.com/board/view/?id=car_new1&no=10377916,2025-02-10 22:35:45,뭐가 더 나음? 블랙 가까운 진한 회색이 좋아서 아그로 하려다가 밝은데서 녹조 이끼색 비치는 게 좀 그렇더라 그래서 에그로 할랬능데 에그도 밝은데서 보면 좀 밝은 회색+죠스바색이라 뭔가 옛날 노땅차 느낌 나길래 무한 고민 중,차갤러 (210.108),52,0,0,0
아반떼쏘나타 뭐 가야됨?,https://gall.dcinside.com/board/view/?id=car_new1&no=10377889,2025-02-10 22:27:27,"가성비나 내 용도에 맞게 사면(시내 출퇴근, 주말 데이트) 아반떼로도 차고 넘칠 거 같은데또 10년 넘게 탈거고 나이대도 생각하면 쏘나타가 맞는 거 같고조언좀 부탁드림",차갤러 (59.0),125,1,1,0
아반떼살 돈이면 오버리터급 BMW 산다,https://gall.dcinside.com/mgallery/board/view/?id=staycreal&no=263554,2025-02-10 22:25:39,이런거 하나 장만하고 싶구나,ㅇㅇ (222.121),19,0,0,0
우리나라 사람들 왤케 부자가 많냐,https://gall.dcinside.com/board/view/?id=car_new1&no=10377870,2025-02-10 22:23:25,서울도 아니고 지방인데도최소 그랜저임외제차 ㅈㄴ많도 제네시스 ㄹㅇ 존나 많음소나타나 아반떼 보는게 더 힘드네,ㅇㅇ (175.203),98,0,0,0
아반떼N 샀다,https://gall.dcinside.com/mgallery/board/view/?id=shutokoubattle&no=1400,2025-02-10 22:12:41,쎄타엔진 비스무리한거 들어가고 준중형이니까 아무튼 아엔 맞음,ㅁㅋㅇ (222.110),227,0,0,0
아반떼가 제일 빠른차임,https://gall.dcinside.com/board/view/?id=car_new1&no=10377819,2025-02-10 22:11:25,걍 미친새끼처럼 밟으니까 피해서 가게 되더라,토네이도 (175.203),73,0,0,0
아반떼풀옵션이 3300밖에 안한다고?,https://gall.dcinside.com/board/view/?id=car_new1&no=10377810,2025-02-10 22:09:02,사야겠지?- dc official App,차갤러 (211.235),50,0,0,0
현대차 디자인은 왜 변태가 되버렸지. 그 시점이,https://gall.dcinside.com/board/view/?id=car_new1&no=10377800,2025-02-10 22:06:27,"생각해보니깐 그 시점이 아반떼 부터였던 걸로.갑자기 아반떼가 아주 조잡하게 각진 형태로 나왔고, 첨봤을 때 뭐야 디자인이 왜 저렇게 조잡해라고 생각했지.그리고 쏘나타도 그랜저도 변태.쏘나타 뉴라이즈까지는 괜찮았어. 그 후 디자인이 변태가 되버렸고.아반떼도 아반떼ad까지는 괜찮았어. 그 후 변태가 되버렸고.그랜저는 그랜저ig는 진짜 디자인 좋았어.그 담 더뉴그랜저에서 후퇴했고, 그 후부턴 ig보다 디자인이 전부 이상하고.기아도 비슷하지만 그나마 현대보단 낫고.k5는 2019년 더뉴k5 디자인이 최고였고, 그 후부턴 디자인이 후퇴한 변태 k5가 계속 출시.k7은 2019년에 나온 k7이 디자인 최고엿고 그 후부터 ㅄ중에 쌍 ㅄ디자인이 되었고,k9는 무난하게 예전이나 지금이나 적당하고.대체 현대차 디자인 누구냐. 진짜 변태짓거리로 변태디자인만 만들었다",ㅇㅇ (210.207),94,1,0,0
앰비언트 DIY로 해볼까,https://gall.dcinside.com/board/view/?id=car_new1&no=10377764,2025-02-10 21:57:34,요즘 아반떼는 기본옵션으로 앰비언트를 넣어주네 ㅅㅂ,차갤러 (118.235),33,1,0,0
꼭 뚜벅이들이아반떼N 빨더라,https://gall.dcinside.com/board/view/?id=car_new1&no=10377758,2025-02-10 21:56:41,에휴 말이 안 통해,차갤러 (58.236),72,3,0,0
새벽 호남지선 고속도로 가장 주의해야하는 차가 무엇인지 아나?,https://gall.dcinside.com/board/view/?id=jungsopd&no=1201015,2025-02-10 21:56:11,"내 똥꼬를 무는 언더네온 튜닝한 k5?""아니""직진코스에서 추월하려하면 풀악셀밟는 530i?""아니""카멜레온 랩핑 / 중통 / 빅윙 달은 g70 3.3?""아니""샛노란 4륜안으로 널 노려보며 다가오는 풀튜닝 카니발?""아니""그럼 현행 공도 최강자 TCR 씹어먹는 데이터를 그대로 이식받은 서킷겸용이 가능한 전륜 최강자 아반떼N?""아니""모두 틀렸다 정답은 바로""바로 기술테크 중소기업 법인 레이 다""좃1소 테크법인레이 내뒤로 꽁무니 붙으면 진짜 이악물고 코너링탄다 얘낸 내일이 없다.방심해서 코너 아웃코스 칠때 속도 줄이면 바로 아웃라인에서 한바퀴 붕 뜨면서 3바퀴로 코너링 타는 모습을 보여준다항상 야밤 호남지선을 달릴땐좃1소 테크 레이를 조심해야한다.그들은 어디에나 있고, 너의 뒤에 있다가도어느샌가 너의 앞에 존재한다.- dc official App",히히뇸뇸 (211.234),88,0,0,0
요샌 일단 그랜저 아랫급 세단은 전부 돈없는 거지 이미지임,https://gall.dcinside.com/board/view/?id=car_new1&no=10377754,2025-02-10 21:55:34,"아반떼 -> 코나, 셀토스 살돈없는 거지쏘나타 -> 투싼, 스포티지 살돈 모자른 거지그랜저 -> 싼타페, 쏘렌토랑 가격 비슷함ㅇㄱㄹㅇ;;그리고 투싼, 스포티지급 부턴 하브도 많이사서기본적으로 가솔린 출고가 대부분인 쏘나타 k5랑 출고가격 차이 많이남- dc official App",ㅇㅇ (223.39),155,1,1,0
전 흙수저답게아반떼AD 중고나 탈라고요,https://gall.dcinside.com/board/view/?id=lovelive_new1&no=270781,2025-02-10 21:51:12,어디 싸돌아다니는 타입도 아니고 나중가서 취업이나 개원할때나 외제 생각해볼듯,ㅇㅇ (182.237),54,0,0,0
고민 해결좀요,https://gall.dcinside.com/board/view/?id=car_new1&no=10377726,2025-02-10 21:49:13,아반떼 cn7 페리 이전 차량 중고를 보고 있었는데현대인증중고차에서 풀옵션급에 1인신조 무사고 등등 하자 없는 차량으로 고르니까 세금 다 더해서 2400이 들더라고요엄마가 사주시는건데 이번에 사면 7년은 탈 각오하라고 하시더라고요오래탈거면 신차를 타는게 유리할거같기도 하다는 욕망이 들기 시작했어요.그래서 그런데 아반떼 2025 스마트 트림이 잘 나왔다고 해서그냥 스마트 트림에 휠+네비게이션+스마트키 옵션 추가해서 뽑는게 어떨까… 이러면 가격은 다 합쳐서 2500 갈 거 같아요,차갤러 (119.149),65,0,0,0
월주차 끊으니까 주차 스트레스 확 사라지네 ㄷㄷ,https://gall.dcinside.com/board/view/?id=car_new1&no=10377695,2025-02-10 21:41:55,아반떼 사이즈까지만 허용되는 실내 주차장 정액권 끊었음ㅠ월 4만원- dc official App,차갤러 (223.38),58,1,0,0
새벽 호남지선 고속도로 가장 주의해야하는 차가 무엇인지 아나?,https://gall.dcinside.com/board/view/?id=car_new1&no=10377688,2025-02-10 21:39:55,"내 똥꼬를 무는 언더네온 튜닝한 k5?""아니""직진코스에서 추월하려하면 풀악셀밟는 530i?""아니""카멜레온 랩핑 / 중통 / 빅윙 달은 g70 3.3?""아니""샛노란 4륜안으로 널 노려보며 다가오는 풀튜닝 카니발?""아니""그럼 현행 공도 최강자 TCR 씹어먹는 데이터를 그대로 이식받은 서킷겸용이 가능한 전륜 최강자 아반떼N?""아니""모두 틀렸다 정답은 바로""바로 기술테크 중소기업 법인 레이 다""좃1소 테크법인레이 내뒤로 꽁무니 붙으면 진짜 이악물고 코너링탄다 얘낸 내일이 없다.방심해서 코너 아웃코스 칠때 속도 줄이면 바로 아웃라인에서 한바퀴 붕 뜨면서 3바퀴로 코너링 타는 모습을 보여준다항상 야밤 호남지선을 달릴땐좃1소 테크 레이를 조심해야한다.그들은 어디에나 있고, 너의 뒤에 있다가도어느샌가 너의 앞에 존재한다.- dc official App",히히뇸뇸 (223.39),94,0,0,0
사이드미러가 자동으로 안접힘아반떼,https://gall.dcinside.com/board/view/?id=car_new1&no=10377639,2025-02-10 21:25:05,카셰어링 이용중인데 폰으로 스마트키 씀원래 잠그면 사이드미러가 자동으로 잠기잖아근데 차 잠궈도 사이드미러 안접히고 2-3초뒤에 삑삑 소리나면서 깜빡이 한번 켜졌다 꺼짐 이거 해결방법좀 알려줘 사고나 이런거 난적없음- dc official App,차갤러 (211.235),57,0,0,0
동생 차 급하게 필요해서 사는데 조건이 별로네...,https://gall.dcinside.com/board/view/?id=car_new1&no=10377551,2025-02-10 20:59:42,아반테 하이브리드 살라고하는데지금 요청하면 최소 5개월이라 그래서 전시차 알아봤는데1. 전시차 한달 전시 할것 미리 계약 (2/10 오늘 대리점 입고)2. 전시차 할인은 20만원3. 탁송료 부담. (공장 -> 대리점)진짜 이득되는거 없네...,차갤러 (119.194),49,0,0,0
아반떼엔진오일 경고등이 자꾸 뜨는데 이유아는사람 있음?,https://gall.dcinside.com/board/view/?id=car_new1&no=10377550,2025-02-10 20:59:31,"16년식 아반떼인데요즘 브레이크 밟거나, 주차할때 후진 넣기전에 브레이크 밟거나 그러면0.1초 정도 엔진오일 경고등이 떳다가 없어져엔진오일 간지도 3개월밖에 안됐는데..왜그런지 아는사람 있어?",ㅋㅋ (211.211),89,0,0,0
장필주 이새끼 차에대해 1도 모르는듯ㅋㅋ,https://gall.dcinside.com/mgallery/board/view/?id=popkontv&no=1050280,2025-02-10 19:48:09,타이어볼때  옆에 슬쩍보고 판단을 하질않나   ㅋ아반떼md  12년식   GDI  초기형  결함엔진을주차장 두어바퀴 돌아보고 브레이크 잘잡히네 하며덜컥 산다고 난리부르스   떨질않나ㅋㅋ오일감소는 기본이고  10년지나서  엔진리콜도 끝나서타다가  엔진피스톤 딱딱거리면  수리비 개폭탄인데개좆도 모르는 호구내구성좋고 연료비 작게드는  K5가스  놔두고내구성쓰레기에  가솔린 md 선택하는  빙시그튼 새기가차안다고 ㅈㄹ  ㅋㅋㅋ,ㅇㅇ (211.46),591,6,2,0
트블vs아반떼면 닥치고아반떼임??,https://gall.dcinside.com/board/view/?id=car_new1&no=10377361,2025-02-10 19:45:50,좆반떼 존나 시릉데 ㅠㅠ- dc official App,차갤러 (222.100),79,0,1,0
